{
  "slug": "qixia-njfls-xianlin-fenxiao",
  "name": "南京外国语学校仙林分校",
  "region": "nanjing",
  "districtName": "栖霞区",
  "schoolStageLabel": "完全中学",
  "schoolPropertyLabel": "民办",
  "schoolKeyLevel": "强民办(初中)",
  "eliteCohort": "",
  "group": "南京外国语学校",
  "address": "南京市栖霞区仙林大学城仙林大道136号",
  "phone": "025-84027918",
  "website": "http://www.nflsxl.com",
  "foundingYear": 2002,
  "isBoarding": true,
  "isInternational": true,
  "image": "",
  "profileDepth": "foundation",
  "features": ["外语特色", "国际课程（中澳/美高/德国/A-Level等）"],
  "admissionInfo": { "code": "", "methods": [], "routes": ["普通高考", "出国留学"], "notes": "" },
  "scoreLines": [],
  "outcomeStats": [],
  "content": [],
  "infoVerified": false,
  "source": { "url": "http://www.nflsxl.com/2023/0210/c19a603/page.psp", "crawledAt": "2026-09-12", "confidence": "high" }
}
