{
  "slug": "qinhuai-nanjing-zhongying",
  "name": "南京市钟英中学",
  "region": "nanjing",
  "districtName": "秦淮区",
  "schoolStageLabel": "初中",
  "schoolPropertyLabel": "公办",
  "schoolKeyLevel": "强公办(初中)",
  "eliteCohort": "",
  "group": "",
  "address": "南京市秦淮区九条巷8号",
  "phone": "025-84525507",
  "website": "http://zyzx.njqhjy.net",
  "foundingYear": 1904,
  "isBoarding": false,
  "isInternational": false,
  "image": "",
  "profileDepth": "enhanced",
  "features": ["百年老校", "江苏省现代化示范初中", "江苏省书法特色学校", "南京市教育现代化初中建设学校"],
  "admissionInfo": { "code": "", "methods": [], "routes": [], "notes": "" },
  "scoreLines": [],
  "outcomeStats": [],
  "content": [],
  "infoVerified": false,
  "source": { "url": "https://zyzx.njqhjy.net/xxgk/content_45479", "crawledAt": "2026-09-12", "confidence": "high" }
}
