{
  "slug": "pukou-jiangpu-gaoji-zhongxue",
  "name": "江苏省江浦高级中学",
  "region": "nanjing",
  "districtName": "浦口区",
  "schoolStageLabel": "高中",
  "schoolPropertyLabel": "公办",
  "schoolKeyLevel": "区重点(高中)",
  "eliteCohort": "",
  "group": "",
  "address": "南京市浦口区象山路16号",
  "phone": "025-58115402",
  "website": "",
  "foundingYear": 1939,
  "isBoarding": true,
  "isInternational": false,
  "image": "",
  "profileDepth": "foundation",
  "features": ["江苏省四星级普通高中", "国家级示范性高中", "内地新疆高中班办班学校"],
  "admissionInfo": { "code": "", "methods": [], "routes": [], "notes": "" },
  "scoreLines": [],
  "outcomeStats": [],
  "content": [],
  "infoVerified": false,
  "source": { "url": "https://www.gx211.cn/school/schoolcontent2777.shtml", "crawledAt": "2026-09-12", "confidence": "medium" }
}
