{
  "slug": "qixia-qixia-shiyan-chuzhong",
  "name": "南京市栖霞区实验初级中学",
  "region": "nanjing",
  "districtName": "栖霞区",
  "schoolStageLabel": "初中",
  "schoolPropertyLabel": "公办",
  "schoolKeyLevel": "一般初中",
  "eliteCohort": "",
  "group": "",
  "address": "南京市栖霞区炼油厂生活区0号路3号",
  "phone": "",
  "website": "",
  "foundingYear": null,
  "isBoarding": false,
  "isInternational": false,
  "image": "",
  "profileDepth": "foundation",
  "features": [],
  "admissionInfo": { "code": "", "methods": [], "routes": [], "notes": "" },
  "scoreLines": [],
  "outcomeStats": [],
  "content": [],
  "infoVerified": false,
  "source": { "url": "http://www.njqxq.gov.cn/qxqrmzf/xxgkzl/qssydwndbg/201612/t20161215_1170522.html", "crawledAt": "2026-09-12", "confidence": "high" }
}
