{
  "slug": "luhe-chengqiao-gaoji-zhongxue",
  "name": "南京市六合区程桥高级中学",
  "region": "nanjing",
  "districtName": "六合区",
  "schoolStageLabel": "高中",
  "schoolPropertyLabel": "公办",
  "schoolKeyLevel": "一般高中",
  "eliteCohort": "",
  "group": "",
  "address": "南京市六合区程桥街道编钟路98号",
  "phone": "",
  "website": "",
  "foundingYear": 1956,
  "isBoarding": false,
  "isInternational": false,
  "image": "",
  "profileDepth": "foundation",
  "features": ["江苏省三星级普通高中"],
  "admissionInfo": { "code": "", "methods": [], "routes": [], "notes": "" },
  "scoreLines": [],
  "outcomeStats": [],
  "content": [],
  "infoVerified": false,
  "source": { "url": "https://gx211.cn/school/schoolcontent2804.shtml", "crawledAt": "2026-09-12", "confidence": "medium" }
}
