{
  "slug": "xuanwu-nanjing-fls",
  "name": "南京外国语学校",
  "region": "nanjing",
  "districtName": "玄武区",
  "schoolStageLabel": "完全中学",
  "schoolPropertyLabel": "公办",
  "schoolKeyLevel": "顶级公办(初中)",
  "eliteCohort": "",
  "group": "",
  "address": "南京市玄武区北京东路30号",
  "phone": "025-83612246",
  "website": "https://www.nfls.com.cn",
  "foundingYear": 1963,
  "isBoarding": false,
  "isInternational": false,
  "image": "",
  "profileDepth": "enhanced",
  "features": ["江苏省四星级普通高中", "外语特色"],
  "admissionInfo": {
    "code": "",
    "methods": ["统一招生", "指标生"],
    "routes": [],
    "notes": "提前批次含校内生（中考成绩与外语加试成绩之和录取）与国际课程班等多通道"
  },
  "scoreLines": [
    { "year": "2023", "score": "662", "plan": "校内生", "note": "口径为中考成绩+外语加试之和；来源：南京市政府网转金陵日报（2023-07-11），市招考院公布" },
    { "year": "2024", "score": "700", "plan": "", "note": "提前批校内生投档线，口径为中考成绩+外语加试之和；来源：南京市政府网转载南京日报（2024-07-09）" },
    { "year": "2026", "score": "716", "plan": "校内生", "note": "口径为中考成绩+外语加试之和；来源：金陵晚报（2026-07-14）转南京市招考院录取分数线" }
  ],
  "outcomeStats": [],
  "content": [],
  "infoVerified": false,
  "source": { "url": "https://www.nanjing.gov.cn/zzb/ywdt/msxx/202407/t20240709_5125793.html", "crawledAt": "2026-09-12", "confidence": "high" }
}
