{
  "slug": "gulou-jinling-huiwen",
  "name": "南京金陵汇文学校",
  "region": "nanjing",
  "districtName": "鼓楼区",
  "schoolStageLabel": "初中",
  "schoolPropertyLabel": "公办",
  "schoolKeyLevel": "强公办(初中)",
  "eliteCohort": "",
  "group": "金陵中学",
  "address": "南京市鼓楼区清河路（清河新寓西侧）",
  "phone": "",
  "website": "",
  "foundingYear": 2008,
  "isBoarding": false,
  "isInternational": false,
  "image": "",
  "profileDepth": "enhanced",
  "features": ["九年一贯制", "金陵中学合作办学"],
  "admissionInfo": { "code": "", "methods": [], "routes": [], "notes": "鼓楼区公办九年一贯制学校，初中部由金陵中学管理，施教区由鼓楼区教育局划定" },
  "scoreLines": [],
  "outcomeStats": [],
  "content": [],
  "infoVerified": false,
  "source": { "url": "http://www.jlhs.net/DisplayInfo.jsp?pageID=6729&menuID=366", "crawledAt": "2026-09-12", "confidence": "high" }
}
