{
  "slug": "qixia-nanjing-qixia-zhongxue",
  "name": "南京市栖霞中学",
  "region": "nanjing",
  "districtName": "栖霞区",
  "schoolStageLabel": "高中",
  "schoolPropertyLabel": "公办",
  "schoolKeyLevel": "区重点(高中)",
  "eliteCohort": "",
  "group": "",
  "address": "南京市栖霞区尧化门金尧路15号",
  "phone": "025-85763195",
  "website": "http://www.njsqxzx.com",
  "foundingYear": 1923,
  "isBoarding": false,
  "isInternational": false,
  "image": "",
  "profileDepth": "foundation",
  "features": ["江苏省四星级普通高中"],
  "admissionInfo": { "code": "", "methods": [], "routes": [], "notes": "学校官网招生启事：南京中考第一批次录取，2025年计划招生600人" },
  "scoreLines": [],
  "outcomeStats": [],
  "content": [],
  "infoVerified": false,
  "source": { "url": "http://www.njsqxzx.com/id331485.html", "crawledAt": "2026-09-12", "confidence": "high" }
}
