{
  "slug": "gaochun-gaochun-gaoji-zhongxue",
  "name": "江苏省高淳高级中学",
  "region": "nanjing",
  "districtName": "高淳区",
  "schoolStageLabel": "高中",
  "schoolPropertyLabel": "公办",
  "schoolKeyLevel": "区重点(高中)",
  "eliteCohort": "",
  "group": "",
  "address": "南京市高淳区镇兴路185号",
  "phone": "025-57338400",
  "website": "",
  "foundingYear": 1923,
  "isBoarding": false,
  "isInternational": false,
  "image": "",
  "profileDepth": "foundation",
  "features": ["江苏省四星级普通高中", "江苏省重点中学"],
  "admissionInfo": { "code": "", "methods": [], "routes": [], "notes": "" },
  "scoreLines": [],
  "outcomeStats": [],
  "content": [],
  "infoVerified": false,
  "source": { "url": "https://www.aqsgcw.com/invest/show-2854.html", "crawledAt": "2026-09-12", "confidence": "low" }
}
