{
  "slug": "pukou-pukou-disanzhong",
  "name": "南京市浦口区第三中学",
  "region": "nanjing",
  "districtName": "浦口区",
  "schoolStageLabel": "初中",
  "schoolPropertyLabel": "公办",
  "schoolKeyLevel": "一般初中",
  "eliteCohort": "",
  "group": "",
  "address": "南京市浦口区城运路8号",
  "phone": "025-58883071",
  "website": "",
  "foundingYear": null,
  "isBoarding": false,
  "isInternational": false,
  "image": "",
  "profileDepth": "foundation",
  "features": [],
  "admissionInfo": { "code": "", "methods": [], "routes": [], "notes": "" },
  "scoreLines": [],
  "outcomeStats": [],
  "content": [],
  "infoVerified": false,
  "source": { "url": "https://xuexiao.chahaoba.com/xuexiao_details/75653", "crawledAt": "2026-09-12", "confidence": "low" }
}
