{
  "slug": "lishui-lishui-dier-gaoji-zhongxue",
  "name": "南京市溧水区第二高级中学",
  "region": "nanjing",
  "districtName": "溧水区",
  "schoolStageLabel": "高中",
  "schoolPropertyLabel": "公办",
  "schoolKeyLevel": "区重点(高中)",
  "eliteCohort": "",
  "group": "",
  "address": "南京市溧水区毓秀路5号",
  "phone": "",
  "website": "http://www.lseg.cn",
  "foundingYear": 1981,
  "isBoarding": false,
  "isInternational": false,
  "image": "",
  "profileDepth": "foundation",
  "features": ["江苏省四星级普通高中"],
  "admissionInfo": { "code": "", "methods": [], "routes": [], "notes": "" },
  "scoreLines": [],
  "outcomeStats": [],
  "content": [],
  "infoVerified": false,
  "source": { "url": "https://www.zqy.com/xuexiao/about/3528.html", "crawledAt": "2026-09-12", "confidence": "low" }
}
