{
  "slug": "lishui-lishui-gaoji-zhongxue",
  "name": "江苏省溧水高级中学",
  "region": "nanjing",
  "districtName": "溧水区",
  "schoolStageLabel": "高中",
  "schoolPropertyLabel": "公办",
  "schoolKeyLevel": "区重点(高中)",
  "eliteCohort": "",
  "group": "",
  "address": "南京市溧水区永阳街道天生桥大道88号",
  "phone": "",
  "website": "",
  "foundingYear": 1933,
  "isBoarding": false,
  "isInternational": false,
  "image": "",
  "profileDepth": "foundation",
  "features": ["江苏省四星级普通高中"],
  "admissionInfo": { "code": "", "methods": [], "routes": [], "notes": "" },
  "scoreLines": [],
  "outcomeStats": [],
  "content": [],
  "infoVerified": false,
  "source": { "url": "https://www.gx211.cn/school/schoolcontent467.shtml", "crawledAt": "2026-09-12", "confidence": "medium" }
}
