{
  "slug": "gaochun-hubin-gaoji-zhongxue",
  "name": "南京市高淳区湖滨高级中学",
  "region": "nanjing",
  "districtName": "高淳区",
  "schoolStageLabel": "高中",
  "schoolPropertyLabel": "公办",
  "schoolKeyLevel": "区重点(高中)",
  "eliteCohort": "",
  "group": "",
  "address": "南京市高淳区古檀路8号",
  "phone": "",
  "website": "",
  "foundingYear": 1979,
  "isBoarding": true,
  "isInternational": false,
  "image": "",
  "profileDepth": "foundation",
  "features": ["江苏省四星级普通高中"],
  "admissionInfo": { "code": "", "methods": [], "routes": [], "notes": "" },
  "scoreLines": [],
  "outcomeStats": [],
  "content": [],
  "infoVerified": false,
  "source": { "url": "https://gx211.cn/school/schoolcontent2810.shtml", "crawledAt": "2026-09-12", "confidence": "medium" }
}
