{
  "slug": "luhe-shiyan-gaoji-zhongxue",
  "name": "南京市六合区实验高级中学",
  "region": "nanjing",
  "districtName": "六合区",
  "schoolStageLabel": "高中",
  "schoolPropertyLabel": "公办",
  "schoolKeyLevel": "区重点(高中)",
  "eliteCohort": "",
  "group": "",
  "address": "南京市六合区雄州街道延安北路23号",
  "phone": "025-57126236",
  "website": "http://www.lhqsygz.cn",
  "foundingYear": 1957,
  "isBoarding": true,
  "isInternational": false,
  "image": "",
  "profileDepth": "foundation",
  "features": ["江苏省四星级普通高中"],
  "admissionInfo": { "code": "", "methods": [], "routes": [], "notes": "" },
  "scoreLines": [],
  "outcomeStats": [],
  "content": [],
  "infoVerified": false,
  "source": { "url": "https://wap.yzwb.net/wap/news/2199661.html", "crawledAt": "2026-09-12", "confidence": "medium" }
}
