{
  "slug": "luhe-liuhe-gaoji-zhongxue",
  "name": "江苏省六合高级中学",
  "region": "nanjing",
  "districtName": "六合区",
  "schoolStageLabel": "高中",
  "schoolPropertyLabel": "公办",
  "schoolKeyLevel": "区重点(高中)",
  "eliteCohort": "",
  "group": "",
  "address": "南京市六合区雄州街道长江路116号",
  "phone": "",
  "website": "",
  "foundingYear": 1941,
  "isBoarding": false,
  "isInternational": false,
  "image": "",
  "profileDepth": "foundation",
  "features": ["江苏省四星级普通高中", "国家级示范性普通高中"],
  "admissionInfo": { "code": "", "methods": [], "routes": [], "notes": "" },
  "scoreLines": [],
  "outcomeStats": [],
  "content": [],
  "infoVerified": false,
  "source": { "url": "https://www.gx211.cn/school/schoolcontent466.shtml", "crawledAt": "2026-09-12", "confidence": "medium" }
}
