{
  "slug": "qixia-nsfz-dingjiazhuang-chuzhong",
  "name": "南京师范大学附属中学丁家庄初级中学",
  "region": "nanjing",
  "districtName": "栖霞区",
  "schoolStageLabel": "初中",
  "schoolPropertyLabel": "公办",
  "schoolKeyLevel": "强公办(初中)",
  "eliteCohort": "",
  "group": "南京师范大学附属中学",
  "address": "南京市栖霞区华银路21号",
  "phone": "025-86755655",
  "website": "http://www.nsfzdjz.com",
  "foundingYear": 2014,
  "isBoarding": false,
  "isInternational": false,
  "image": "",
  "profileDepth": "foundation",
  "features": [],
  "admissionInfo": { "code": "", "methods": [], "routes": [], "notes": "" },
  "scoreLines": [],
  "outcomeStats": [],
  "content": [],
  "infoVerified": false,
  "source": { "url": "http://www.nsfzdjz.com/id46712.html", "crawledAt": "2026-09-12", "confidence": "high" }
}
