{
  "slug": "xuanwu-xuanwai",
  "name": "南京玄武外国语学校",
  "region": "nanjing",
  "districtName": "玄武区",
  "schoolStageLabel": "初中",
  "schoolPropertyLabel": "民办",
  "schoolKeyLevel": "顶级民办(初中)",
  "eliteCohort": "",
  "group": "",
  "address": "",
  "phone": "",
  "website": "",
  "foundingYear": 1996,
  "isBoarding": false,
  "isInternational": false,
  "image": "",
  "profileDepth": "enhanced",
  "features": ["外语特色"],
  "admissionInfo": { "code": "", "methods": [], "routes": [], "notes": "民办初级中学，现珠江路校区办学" },
  "scoreLines": [],
  "outcomeStats": [],
  "content": [],
  "infoVerified": false,
  "source": { "url": "https://news.sina.cn/2016-05-17/detail-ifxsehvu9056999.d.html", "crawledAt": "2026-09-12", "confidence": "medium" }
}
