{
  "slug": "xuanwu-nanjing-9zhong",
  "name": "南京市第九中学",
  "region": "nanjing",
  "districtName": "玄武区",
  "schoolStageLabel": "高中",
  "schoolPropertyLabel": "公办",
  "schoolKeyLevel": "区重点(高中)",
  "eliteCohort": "",
  "group": "",
  "address": "",
  "phone": "",
  "website": "",
  "foundingYear": null,
  "isBoarding": false,
  "isInternational": false,
  "image": "",
  "profileDepth": "enhanced",
  "features": ["江苏省四星级普通高中"],
  "admissionInfo": { "code": "1090", "methods": [], "routes": [], "notes": "长江路校区与震旦校区两个校区招生" },
  "scoreLines": [
    { "year": "2024", "score": "617", "plan": "", "note": "长江路校区；来源：南京市政府网转载南京日报（2024-07-09）" },
    { "year": "2025", "score": "620", "plan": "", "note": "长江路校区；来源：江苏中考网转述南京市2025年中招第一批次投档线" }
  ],
  "outcomeStats": [],
  "content": [],
  "infoVerified": false,
  "source": { "url": "https://www.nanjing.gov.cn/zzb/ywdt/msxx/202407/t20240709_5125793.html", "crawledAt": "2026-09-12", "confidence": "medium" }
}
